[
  {
    "id": "VEC-07-RFC-A2-BASE",
    "profile": "hpke-receipt-v1",
    "source": "https://www.rfc-editor.org/rfc/rfc9180.html#appendix-A.2.1",
    "stage": "hpke-rfc",
    "input": {
      "recipientPrivateKey": "0x8057991eef8f1f1af18f4a9491d16a1ce333f695d4db8e38da75975c4478e0fb",
      "recipientPublicKey": "0x4310ee97d88cc1f088a5576c77ab0cf5c3ac797f3d95139c6c84b5429c59662a",
      "ikmE": "0x909a9b35d3dc4713a5e72a4da274b55d3d3821a37e5d099e74a647db583a904b",
      "enc": "0x1afa08d3dec047a643885163f1180476fa7ddb54c6a8029ea33f95796bf2ac4a",
      "info": "0x4f6465206f6e2061204772656369616e2055726e",
      "plaintext": "0x4265617574792069732074727574682c20747275746820626561757479",
      "aad": "0x436f756e742d30"
    },
    "expected": {
      "enc": "0x1afa08d3dec047a643885163f1180476fa7ddb54c6a8029ea33f95796bf2ac4a",
      "ciphertext": "0x1c5250d8034ec2b784ba2cfd69dbdb8af406cfe3ff938e131f0def8c8b60b4db21993c62ce81883d2dd1b51a28"
    },
    "oracle": "RFC 9180 labeled HKDF; Node 24 ChaCha20-Poly1305; @hpke/core 1.9.0 independent decryption",
    "consumers": [
      "#28",
      "#29",
      "#30"
    ]
  },
  {
    "id": "VEC-07-RECEIPT-VALID",
    "profile": "hpke-receipt-v1",
    "source": "docs/design.md#d-08-暗号化受領データと出力イベント",
    "stage": "receipt",
    "input": {
      "info": "0x18bb869e828f7ebc62a5131c93bf35b9a6f865936b8213fb94c636cfff47084a",
      "aad": "0x",
      "plaintext": "0x00000000000000000000000000000000000000000000000000000000000000010000000000000000000000000000000000000000000000000000000000000000",
      "recipientPrivateKey": "0x1580bcb6e57f31d324b662bd4d4a0a680bd2426c3b91641d77296dfde1cbd619",
      "recipientPublicKey": "0x56b416d18e87d34a5bb880343ad2ce86b9b49a991f6b28315884be8ad2607e5b",
      "ikmR": "0xd4f55ee6363c74602a943bf15f6988876c2853cf09df8c8277d5e3fe7c469de0",
      "ikmE": "0xb58032f1ea247e9ffc9a70ccefa5c72814101b3b2d53842bdcd460dc301284ca",
      "expectedOwner": "0x1a642f0e3c3af545e7acbd38b07251b3990914f1",
      "outputOwner": "0x1a642f0e3c3af545e7acbd38b07251b3990914f1",
      "Cx": "12730586376239396577779996276718232087903100639305218386364088504561595411059",
      "Cy": "11546560963110481742356578822308548249278318971213841271481263934160486303484",
      "packet": "0x80a14365bf19db087f8d02f3fcb71565492e0f9df81865b869293989f47696067bc3c54b63c8187216c8e86532acd343a595d9b23966520018f381034c1f2e1642ad40ebee27773ae8d3c694e79592e654b3c3bf3bc4d220e26d543ec66cda490ca907fffdf9a0a48782cdc5f970b9b2"
    },
    "expected": {
      "decision": "accept",
      "enc": "0x80a14365bf19db087f8d02f3fcb71565492e0f9df81865b869293989f4769606",
      "ciphertext": "0x7bc3c54b63c8187216c8e86532acd343a595d9b23966520018f381034c1f2e1642ad40ebee27773ae8d3c694e79592e654b3c3bf3bc4d220e26d543ec66cda490ca907fffdf9a0a48782cdc5f970b9b2",
      "packet": "0x80a14365bf19db087f8d02f3fcb71565492e0f9df81865b869293989f47696067bc3c54b63c8187216c8e86532acd343a595d9b23966520018f381034c1f2e1642ad40ebee27773ae8d3c694e79592e654b3c3bf3bc4d220e26d543ec66cda490ca907fffdf9a0a48782cdc5f970b9b2",
      "ephemeralPrivateKey": "0xe9a7a41e86f212ae147415cf7905bd9dd4654d2ecccf4407232de012f5b382b6",
      "sharedSecret": "0xa2eaec198416707703d3b055f6e8903fd704a7173c6fedb75d790fccce2cae27",
      "key": "0x251cd7374e2b38ac38354a9032b7058b1fe2600de23c5b4c33a9dd8b7d71540a",
      "nonce": "0xa37b5650886110c15d5c8e11",
      "value": "1",
      "blinding": "0"
    },
    "oracle": "RFC 9180 labeled HKDF; Node 24 ChaCha20-Poly1305; @hpke/core 1.9.0 independent decryption",
    "consumers": [
      "#28",
      "#29",
      "#30"
    ]
  },
  {
    "id": "VEC-07-SHORT-PACKET",
    "profile": "hpke-receipt-v1",
    "source": "docs/design.md#d-08-暗号化受領データと出力イベント",
    "stage": "pool-packet",
    "input": {
      "info": "0x18bb869e828f7ebc62a5131c93bf35b9a6f865936b8213fb94c636cfff47084a",
      "aad": "0x",
      "plaintext": "0x00000000000000000000000000000000000000000000000000000000000000010000000000000000000000000000000000000000000000000000000000000000",
      "recipientPrivateKey": "0x1580bcb6e57f31d324b662bd4d4a0a680bd2426c3b91641d77296dfde1cbd619",
      "recipientPublicKey": "0x56b416d18e87d34a5bb880343ad2ce86b9b49a991f6b28315884be8ad2607e5b",
      "ikmR": "0xd4f55ee6363c74602a943bf15f6988876c2853cf09df8c8277d5e3fe7c469de0",
      "ikmE": "0xb58032f1ea247e9ffc9a70ccefa5c72814101b3b2d53842bdcd460dc301284ca",
      "expectedOwner": "0x1a642f0e3c3af545e7acbd38b07251b3990914f1",
      "outputOwner": "0x1a642f0e3c3af545e7acbd38b07251b3990914f1",
      "Cx": "12730586376239396577779996276718232087903100639305218386364088504561595411059",
      "Cy": "11546560963110481742356578822308548249278318971213841271481263934160486303484",
      "packet": "0x80a14365bf19db087f8d02f3fcb71565492e0f9df81865b869293989f47696067bc3c54b63c8187216c8e86532acd343a595d9b23966520018f381034c1f2e1642ad40ebee27773ae8d3c694e79592e654b3c3bf3bc4d220e26d543ec66cda490ca907fffdf9a0a48782cdc5f970b9"
    },
    "expected": {
      "decision": "reject",
      "stage": "pool-packet"
    },
    "oracle": "RFC 9180 labeled HKDF; Node 24 ChaCha20-Poly1305; @hpke/core 1.9.0 independent decryption",
    "consumers": [
      "#28",
      "#29",
      "#30"
    ],
    "baseCase": "VEC-07-RECEIPT-VALID",
    "mutatedField": "packet.length"
  },
  {
    "id": "VEC-07-LONG-PACKET",
    "profile": "hpke-receipt-v1",
    "source": "docs/design.md#d-08-暗号化受領データと出力イベント",
    "stage": "pool-packet",
    "input": {
      "info": "0x18bb869e828f7ebc62a5131c93bf35b9a6f865936b8213fb94c636cfff47084a",
      "aad": "0x",
      "plaintext": "0x00000000000000000000000000000000000000000000000000000000000000010000000000000000000000000000000000000000000000000000000000000000",
      "recipientPrivateKey": "0x1580bcb6e57f31d324b662bd4d4a0a680bd2426c3b91641d77296dfde1cbd619",
      "recipientPublicKey": "0x56b416d18e87d34a5bb880343ad2ce86b9b49a991f6b28315884be8ad2607e5b",
      "ikmR": "0xd4f55ee6363c74602a943bf15f6988876c2853cf09df8c8277d5e3fe7c469de0",
      "ikmE": "0xb58032f1ea247e9ffc9a70ccefa5c72814101b3b2d53842bdcd460dc301284ca",
      "expectedOwner": "0x1a642f0e3c3af545e7acbd38b07251b3990914f1",
      "outputOwner": "0x1a642f0e3c3af545e7acbd38b07251b3990914f1",
      "Cx": "12730586376239396577779996276718232087903100639305218386364088504561595411059",
      "Cy": "11546560963110481742356578822308548249278318971213841271481263934160486303484",
      "packet": "0x80a14365bf19db087f8d02f3fcb71565492e0f9df81865b869293989f47696067bc3c54b63c8187216c8e86532acd343a595d9b23966520018f381034c1f2e1642ad40ebee27773ae8d3c694e79592e654b3c3bf3bc4d220e26d543ec66cda490ca907fffdf9a0a48782cdc5f970b9b200"
    },
    "expected": {
      "decision": "reject",
      "stage": "pool-packet"
    },
    "oracle": "RFC 9180 labeled HKDF; Node 24 ChaCha20-Poly1305; @hpke/core 1.9.0 independent decryption",
    "consumers": [
      "#28",
      "#29",
      "#30"
    ],
    "baseCase": "VEC-07-RECEIPT-VALID",
    "mutatedField": "packet.length"
  },
  {
    "id": "VEC-07-WRONG-KEY",
    "profile": "hpke-receipt-v1",
    "source": "docs/design.md#d-08-暗号化受領データと出力イベント",
    "stage": "receipt-decrypt",
    "input": {
      "info": "0x18bb869e828f7ebc62a5131c93bf35b9a6f865936b8213fb94c636cfff47084a",
      "aad": "0x",
      "plaintext": "0x00000000000000000000000000000000000000000000000000000000000000010000000000000000000000000000000000000000000000000000000000000000",
      "recipientPrivateKey": "0x6ed769a5ba49684cbf456d6d41f5ebb6e255bbc59cd65997db7c176a548eaced",
      "recipientPublicKey": "0x56b416d18e87d34a5bb880343ad2ce86b9b49a991f6b28315884be8ad2607e5b",
      "ikmR": "0xd4f55ee6363c74602a943bf15f6988876c2853cf09df8c8277d5e3fe7c469de0",
      "ikmE": "0xb58032f1ea247e9ffc9a70ccefa5c72814101b3b2d53842bdcd460dc301284ca",
      "expectedOwner": "0x1a642f0e3c3af545e7acbd38b07251b3990914f1",
      "outputOwner": "0x1a642f0e3c3af545e7acbd38b07251b3990914f1",
      "Cx": "12730586376239396577779996276718232087903100639305218386364088504561595411059",
      "Cy": "11546560963110481742356578822308548249278318971213841271481263934160486303484",
      "packet": "0x80a14365bf19db087f8d02f3fcb71565492e0f9df81865b869293989f47696067bc3c54b63c8187216c8e86532acd343a595d9b23966520018f381034c1f2e1642ad40ebee27773ae8d3c694e79592e654b3c3bf3bc4d220e26d543ec66cda490ca907fffdf9a0a48782cdc5f970b9b2"
    },
    "expected": {
      "decision": "reject",
      "stage": "receipt-decrypt"
    },
    "oracle": "RFC 9180 labeled HKDF; Node 24 ChaCha20-Poly1305; @hpke/core 1.9.0 independent decryption",
    "consumers": [
      "#28",
      "#29",
      "#30"
    ],
    "baseCase": "VEC-07-RECEIPT-VALID",
    "mutatedField": "recipientPrivateKey"
  },
  {
    "id": "VEC-07-ENC-CHANGED",
    "profile": "hpke-receipt-v1",
    "source": "docs/design.md#d-08-暗号化受領データと出力イベント",
    "stage": "receipt-decrypt",
    "input": {
      "info": "0x18bb869e828f7ebc62a5131c93bf35b9a6f865936b8213fb94c636cfff47084a",
      "aad": "0x",
      "plaintext": "0x00000000000000000000000000000000000000000000000000000000000000010000000000000000000000000000000000000000000000000000000000000000",
      "recipientPrivateKey": "0x1580bcb6e57f31d324b662bd4d4a0a680bd2426c3b91641d77296dfde1cbd619",
      "recipientPublicKey": "0x56b416d18e87d34a5bb880343ad2ce86b9b49a991f6b28315884be8ad2607e5b",
      "ikmR": "0xd4f55ee6363c74602a943bf15f6988876c2853cf09df8c8277d5e3fe7c469de0",
      "ikmE": "0xb58032f1ea247e9ffc9a70ccefa5c72814101b3b2d53842bdcd460dc301284ca",
      "expectedOwner": "0x1a642f0e3c3af545e7acbd38b07251b3990914f1",
      "outputOwner": "0x1a642f0e3c3af545e7acbd38b07251b3990914f1",
      "Cx": "12730586376239396577779996276718232087903100639305218386364088504561595411059",
      "Cy": "11546560963110481742356578822308548249278318971213841271481263934160486303484",